BREAKING NEWS reportedly burns alive 45 people in western Iraqi town near air base housing of 400 US Marines,
Whats really happening in the fight against This is a critical look at the big picture,
Whats the apocalyptic prophecy thats driving explains via,
Unemployment not Islam is what drives savagery We know this because unemployed MidEast Christians are just as barbar wait a sec,
RETWEET this if you agree with Donald Rumsfeld The ONLY way to deal with is to GO AFTER THEM,
fighters have launched a major assault on Kurdish positions southwest of Irbil Iraq Kurdish officials said,
This is a RELIGIOUS war is ignoring that these people are Islamic Extremists,
burned 45 people alive Think about it Their omnipresent brutality desensitised us to the point where its not headline news anymore,
BREAKING NEWS launches major assault on Kurdish positions near Irbil in Kurdcontrolled region of Iraq Kurdish officials say,
leaders standing up with unequivocal condemnation of Tune in to,
New poll finds that majority of Americans think US handling of going badly,
Thousands fleeing chaos in 2 490 migrants arrived by boat in last 72 hours Map,
might be harvesting organs Iraqi ambassador tells UN amid reports of more hostages being burned alive,
The Denmark shooting suspect swore fidelity to an leader on his apparent page,
may be harvesting organs Iraqs ambassador to the UN claims We have bodies Come and examine them,
RETWEET this if you agree beheads 21 Egyptian Christians Egypt fighting back SHOULD HAVE been on front page of,
If I were Editor Chief of I would have the beheading Christians on the FRONT PAGE,
CNNORC poll 78 of Americans say Congress should authorize President Obama to fight,
Our strategy to defeat needs 3 things 1Go in HIT HARD 2Political solution 3Recognize ideological war,
Coldblooded murder of Copts in a war crime,
strikes in after barbaric beheadings of 21 Christians Gen Keane on at 9p ET to discuss US strategy,
47 of Americans favor using US ground troops to fight and Id bet 995 of them wouldnt be among those troops,
Do Your Damn Job Is At War With US Obama is FundraisingCongress Vacationing,
We will take every measure to protect our citizens Sameh Shoukry Egypts foreign minister on,
This is an absolute mustread if you really wish to understand what is all about Fascinating analysis,
No words for this devotes 10x more coverage to than beheadings,
We are NOT recognizing WHO our enemy is and what happened in is a direct result of that,
The reality is that is Islamic Very Islamic,
Extraordinary warriors Now pushing hard on s way defeating controlling new strategic points,
Go get em Watch These F22 Raptors Refuel In Midair During An Airstrike Against,
33 While we mourn w the families of the 21 victims we should heed this warning is spreading The storm is coming,
Report FBI had spy in bedroom of German rapper turned poster boy,
has momentum to keep expanding General Garner warns,
Pope denounces beheading of Egyptian Christians by,
UAE F16 fighter jets strike oil refineries controlled by,
Will you join us as we help care for the families of the 21 Christian men who have been killed for their faith,
ISIS kills its pilot Jordan bombs ISIS kills its Christians Egypt bombs kills Americans Obama golfs,
Triedandtrue tactic Netanyahus election ad claims liberals will open Israel to,
Egypt Christian victims are members of Egypts ancient Christian church traces its roots to the apostle Mark,
Pope condemns beheading of Egyptian Christians says blood cries out to be heard,
Heartbreaking relatives and friends mourn the 21 Coptic Christians mass beheaded by,
Empire Smuggling shakedowns donations feed swelling terror budget,
Egypt launches second wave of airstrikes on in Libya,
Extraoficial entrego pasaportes a están bajo investigación de servicios de inteligencia,
There is no peaceful solution to the global jihad Neither love nor talk will stop it We must kill the enemy who is killing us,
difunde video de una presunta decapitación masiva de cristianos coptos en Libia,
burns Kurdish Muslims alive beheads Egyptian Christians humiliation parade,
Egypt hits in Libya in response to video showing beheading of Christians,
Egypt retaliates after video appears to show beheadings of over a dozen people,
toma revancha por decapitación masiva de cristianos coptos y bombardea,
Obama asked Congress to formally authorize use of military force to fight sources say,
Turn back to God stop slaughter you devils Old woman rants at fighters in Syria,
Share their names not their final moments at the hands of brutality,
Horrific beheads 21 Christians in Libya Where states collapse often after Western intervention ISIS follows,
Turkish Otokar Cobra military vehicle is inside training camp How did ISIS get military vehicles,
BREAKING Weve targeted hundreds of social media accounts belonging to members and erased them,
US eyeing new air base in amid talk of major offensive on,
Who cares about being politically correct when innocent people are dying We need to crush,
is scheduled to speak 330p ET on a request for congressional authority to use military force vs,
on how he would address threat,
linked imminent terror attack foiled by Australian police 2 arrested,
beautiful smile is much stronger than darkness She will be remembered,
??? ? ??? ?????? ??? ? ????,
Top US defense official says its no coincidence has victims wear orange jumpsuits like Gitmo,
has alienated MANY with their brutal tactics,
is not Wests main strategic threat in the Middle East says,
A Former Muslim sends a powerful message to AlBaghdadi and ISIS,
savagely killed by worked with International Solidarity Movement same foundation as Rest in Power,
