Snapchat Is Full Of AfterSex Selfies And These Are The Best see more click here,
Snapchat Is Full Of AfterSex Selfies And These Are The Best see more click here,
Okay Jeb Bush just went on record saying he opposes samesex marriage Can we stop pretending hes some new LGBT ally now,
The rate of sextoyrelated hospitalizations in the US has doubled since 2007,
Young Republicans favor legal marijuana 63 samesex marriage 58,
Young Republicans favor legal marijuana 63 samesex marriage 58,
Revelations about the sexmad depravity of ISIS puts them on par with Abu Ghraib war crimes,
83 of sextrafficking victims in the United States are American citizens,
Legalized samesex marriage has led to Rick Santorums worst nightmare Complete irrelevance,
Study Stem Cell Breakthrough Opens Door To SameSex Couples Having Their Own Babies,
US churches say banning samesex marriage has nothing to do with homosexuality,
Jeb Bush knows the court is going to legalize samesex marriage He snuck some hate in at CPAC before he settles into respect the courts,
55 percent of Americans are in favor of samesex marriage,
Magic spells wizards astral time travel and a sadistic sexcrazed king,
