Follow me on my new fav app I will be the new selfie God,
Shout out to the Champ and for all the traffic 6000 retweets and 240000,
miss you too,
Hey man would you mind following some of your fans who retweet this Including please,
Johnny did a great job on this,
thx John Im glad u liked it bro,
you have some serious fans on here yo,
Apparently one of the ppl who shared has been on Twitter since 1969 And loves cc,
WATCH MY ACOUSTIC VERSION OF NEW SINGLE WAY 2 DRUNK Pass it on if you like it I follow RTRTRT,
