Seeing a Cash Cow in Museums Precious Art,
See MaryKate Olsens Very Chic New NYC Home,
Want to live like an Olsen Peek inside MaryKates STUNNING New York City apartment,
Slender Illuminated Anthropomorphic Figures By Arturo Alvarez,
Mixtapesong cover special 50 design per cover lets work,
Slender Illuminated Anthropomorphic Figures By Arturo Alvarez,
Selling the collection to cover cutbacks or expenses Is this the right strategy for a cash strapped museum,
Take your business to the next level w this Powerpoint Keynote Template,
mired in debt from investments in US subprime mortgages EU museums plunder natl artistic patrimony,
FREE SHIPPING WORLDWIDE IN MY Society6 Store USE LINK,
Seeing a Cash Cow in Museums Precious Art,
Perfect purple HEART OF DRAGON,
The UKRE8 Art Design Daily is out Stories via,
ARTS Seeing a Cash Cow in Museums Precious Art see more,
Want to visit a European museum Just check the living rooms walls of a Saudi prince or hedge fund billionaire,
