We will bring in legislation to deal with people who wont pay their water charges Environment Min Alan Kelly,
Environment Minister Alan Kelly says hes not worried about the lack of minutes from some Irish Water meetings,
Environment Minister Alan Kelly tells hes not worried by the lack of minutes,
Alan Kellys career is finished he smiles laughs talking about peoples anger at his threats This is SERIOUS Govt in trouble,
It seems Alan Kelly is doing everything in his power to not get re elected,
Is Alan Kelly blind and deaf or just dog ignorant and stupid Dont antagonise via,
Ireland NEW Trending Topics Alan Kelly,
People dont like to be threatened by their employees and Alan Kelly would do well to heed that via,
promisesmore bribesmore liesRabbitte psychology at workAlan Kelly TD going to allow Irish Water into our wage packets,
Alan Kelly like a rabbit in the headlights stick carrot stick carrot and now were back to via,
Alan Kelly talks up theGreat Recoveryto say they have now got Money 4 Housing Reality is EIB is loaning the Money under the Table,
no I am pleased with Alan Kelly think format of programme awful,
Ireland NEW Trending Topics Alan Kelly,
Id say Reason that Alan Kelly is upset at the 20 Central BK Savings Ratio is its slowing Tax Revenue into Govt in an Election Yr,
We will bring in legislation to deal with people who wont pay their water charges Alan Kelly via,
