Is executioner American His accent is causing many to take note,
The is investigating claims that is harvesting organs from the dead and selling them on the black market,
UN is looking into accusations that is selling human organs via,
3 000 infiltrators may enter Turkey plan to attack diplomatic targets report,
members now openly mocking CNN for their report on Nutella and Cats,
fans kick prisoners to death The sickness spreads,
Behind the brutality of is a sophisticated moneymaking operation with funds from oil blackmail smuggling,
RETWEET this if you agree that we are at war with Islamic Extremism,
Now we tell the enemy when where with what forces we will attack them unbelievable,
Venta de petróleo impuestos saqueos extorsiones así gana dinero,
Could plans for a new offensive against put US forces back in the line of fire begins at 8p on,
A major operation in the works to recapture one of Iraqs most important cities from,
HUH Cant Win A War By Killing Your Enemies,
Por qué fracasa la lucha contra,
linked accounts warn to Rome God willing create hashtags,
I know SO many Americans in this country that DO NOT have jobs but they arent going out and beheading people,
State Dept thinks just needs better jobs to dissuade them from being terrorists Ive got a job for em holding my DownRange targets,
RETWEET if you agree with I think the is a SLAP IN THE FACE to Israel,
atrocity in Libya shows its growing reach Was Libya better off under Gadhafi reports,
Its CURIOUS as to why didnt say that the beheaded Egyptians were Christians,
Lets get someone else in charge who UNDERSTANDS the threat who will kill,
plans to invade Europe through report,
President Obama to address the global threat of at the Countering Violent Extremism Summit Watch live,
Après leurs prisonniers et les livres brûle maintenant les instruments de musique,
I would call it a death cult believes its involved in creating the stages of an apocalyptic future,
fighters outgunned while taking on armed with stolen American equipment reports on,
is aware of allegations harvesting organs for cash has no reason to doubt it reports,
now controls four major cities along the Libyan coast,
????????????????????????????????????? ????? ????,
Un pueblo de llora a sus hijos luego de la matanza de,
Timothy Cardinal Dolan on and the Islamic faith,
Whats really happening in the fight against This is a critical look at the big picture,
PHOTO Cleanup operations have begun in A lot of dead members,
None of your grievances are legitimate when you behead innocent Christians and burn alive a man in a cage,
Photos of the cleanup in is of course from one of our good friends give him a follow,
Why the Fight Against is Failing by via,
Unemployment not Islam is what drives savagery We know this because unemployed MidEast Christians are just as barbar wait a sec,
Same group that killed ambassador to r the same group is supporting now,
to address the global threat of at the Countering Violent Extremism Summit Watch live,
just 300 miles from Italy so s PM says its counting on the UN,
Did I miss all the outrage about burning 45 Iraqi men alive couple of day ago Or was there just no outrage,
Feb 18 On the 156th day of Resistance against terrorists,
The UN is looking into allegations that may be harvesting organs,
might be harvesting organs Iraqi ambassador tells UN amid reports of more hostages being burned alive,
