text,confidence(negative),confidence(positive),prediction(Sentiment)
Portrait Biebs Young Man Winter Oakland Art Walk cc ,0.5073904993063404,0.49260950069365966,negative
Follow fav app selfie God ,0.5073904993063404,0.49260950069365966,negative
Shout Champ traffic retweets ,0.7047502597602852,0.2952497402397148,negative
thx John Im glad liked bro ,0.4993098860654074,0.5006901139345926,positive
Apparently ppl shared Twitter loves cc ,0.6770964299874177,0.32290357001258224,negative
miss,0.7146346030000875,0.2853653969999125,negative
