text,confidence(Negative),confidence(Positive),prediction(Sentiment)
congrat make proud follow ,1.0,0.0,Negative
get readi go ,0.010393950919810295,1.0,Positive
wonder floyd bieb becam pal stori start ,1.0,0.0,Negative
forreal thi point mani facetim screen shot think got ,1.0,0.0,Negative
comedi club watch great time jb hi crew ,1.0,0.0,Negative
said kill tonight dy thx man youv see big show crazi time ,1.0,0.0,Negative
lmfao,0.010393950919810295,1.0,Positive
why ar creep creep ,0.010393950919810295,1.0,Positive
